{
  "schema_version": 1,
  "algorithm": "composite-header",
  "source": "generated by tacenta-model Vectors.lean (lake exe genvectors composite)",
  "vectors": [
    { "id": "with-a-codeword", "inputs": { "dh": "5a5a5a5a5a5a5a5a5a5a5a5a5a5a5a5a5a5a5a5a5a5a5a5a5a5a5a5a5a5a5a5a", "pn": "00000007", "n": "00000009", "pq_epoch": "0000000000000003", "pq_n": "000000000000000b", "ag_epoch": "0000000000000003", "ag_type": "04", "chunk_present": "01", "chunk_index": "0005", "chunk_data": "cdcdcdcdcdcdcdcdcdcdcdcdcdcdcdcdcdcdcdcdcdcdcdcdcdcdcdcdcdcdcdcd" }, "output": "01015a5a5a5a5a5a5a5a5a5a5a5a5a5a5a5a5a5a5a5a5a5a5a5a5a5a5a5a5a5a5a5a00000007000000090000000000000003000000000000000b000000000000000304010005cdcdcdcdcdcdcdcdcdcdcdcdcdcdcdcdcdcdcdcdcdcdcdcdcdcdcdcdcdcdcdcd" },
    { "id": "without-a-codeword", "inputs": { "dh": "5a5a5a5a5a5a5a5a5a5a5a5a5a5a5a5a5a5a5a5a5a5a5a5a5a5a5a5a5a5a5a5a", "pn": "00000007", "n": "00000009", "pq_epoch": "0000000000000003", "pq_n": "000000000000000b", "ag_epoch": "0000000000000003", "ag_type": "00", "chunk_present": "00", "chunk_index": "0000", "chunk_data": "0000000000000000000000000000000000000000000000000000000000000000" }, "output": "01015a5a5a5a5a5a5a5a5a5a5a5a5a5a5a5a5a5a5a5a5a5a5a5a5a5a5a5a5a5a5a5a00000007000000090000000000000003000000000000000b0000000000000003000000000000000000000000000000000000000000000000000000000000000000000000" },
    { "id": "every-counter-saturated", "inputs": { "dh": "0000000000000000000000000000000000000000000000000000000000000000", "pn": "ffffffff", "n": "ffffffff", "pq_epoch": "ffffffffffffffff", "pq_n": "ffffffffffffffff", "ag_epoch": "ffffffffffffffff", "ag_type": "03", "chunk_present": "01", "chunk_index": "ffff", "chunk_data": "ffffffffffffffffffffffffffffffffffffffffffffffffffffffffffffffff" }, "output": "01010000000000000000000000000000000000000000000000000000000000000000ffffffffffffffffffffffffffffffffffffffffffffffffffffffffffffffff0301ffffffffffffffffffffffffffffffffffffffffffffffffffffffffffffffffffff" }
  ]
}
