{
  "schema_version": 1,
  "algorithm": "hkdf-sha256",
  "source": "RFC 5869, appendix A",
  "vectors": [
    {
      "id": "rfc5869-a1",
      "comment": "Basic test case with SHA-256, L = 42.",
      "inputs": {
        "ikm": "0b0b0b0b0b0b0b0b0b0b0b0b0b0b0b0b0b0b0b0b0b0b",
        "salt": "000102030405060708090a0b0c",
        "info": "f0f1f2f3f4f5f6f7f8f9",
        "length": "2a"
      },
      "output": "3cb25f25faacd57a90434f64d0362f2a2d2d0a90cf1a5a4c5db02d56ecc4c5bf34007208d5b887185865"
    },
    {
      "id": "rfc5869-a2",
      "comment": "Longer inputs and output, L = 82.",
      "inputs": {
        "ikm": "000102030405060708090a0b0c0d0e0f101112131415161718191a1b1c1d1e1f202122232425262728292a2b2c2d2e2f303132333435363738393a3b3c3d3e3f404142434445464748494a4b4c4d4e4f",
        "salt": "606162636465666768696a6b6c6d6e6f707172737475767778797a7b7c7d7e7f808182838485868788898a8b8c8d8e8f909192939495969798999a9b9c9d9e9fa0a1a2a3a4a5a6a7a8a9aaabacadaeaf",
        "info": "b0b1b2b3b4b5b6b7b8b9babbbcbdbebfc0c1c2c3c4c5c6c7c8c9cacbcccdcecfd0d1d2d3d4d5d6d7d8d9dadbdcdddedfe0e1e2e3e4e5e6e7e8e9eaebecedeeeff0f1f2f3f4f5f6f7f8f9fafbfcfdfeff",
        "length": "52"
      },
      "output": "b11e398dc80327a1c8e7f78c596a49344f012eda2d4efad8a050cc4c19afa97c59045a99cac7827271cb41c65e590e09da3275600c2f09b8367793a9aca3db71cc30c58179ec3e87c14c01d5c1f3434f1d87"
    }
  ]
}
