{
  "schema_version": 1,
  "algorithm": "erasure-encoder-state",
  "source": "generated by tacenta-model Vectors.lean (lake exe genvectors erasure-encoder-state), from Model.Erasure",
  "vectors": [
    { "id": "fresh", "comment": "an encoder that has issued nothing", "inputs": { "message": "010e1b2835424f5c697683909daab7c4d1deebf805121f2c394653606d7a8794a1aebbc8d5e2effc091623303d4a5764717e8b98a5b2bfccd9e6f3000d1a2734414e5b6875828f9ca9b6c3d0ddeaf704111e2b3845525f6c798693a0adbac7d4e1eefb08", "issued": "00000000" }, "output": "00000000000004010e1b2835424f5c697683909daab7c4d1deebf805121f2c394653606d7a8794a1aebbc8d5e2effc091623303d4a5764717e8b98a5b2bfccd9e6f3000d1a2734414e5b6875828f9ca9b6c3d0ddeaf704111e2b3845525f6c798693a0adbac7d4e1eefb0800000000000000000000000000000000000000000000000000000000" },
    { "id": "mid-prefix", "comment": "two systematic codewords issued", "inputs": { "message": "010e1b2835424f5c697683909daab7c4d1deebf805121f2c394653606d7a8794a1aebbc8d5e2effc091623303d4a5764717e8b98a5b2bfccd9e6f3000d1a2734414e5b6875828f9ca9b6c3d0ddeaf704111e2b3845525f6c798693a0adbac7d4e1eefb08", "issued": "00000002" }, "output": "00020000000004010e1b2835424f5c697683909daab7c4d1deebf805121f2c394653606d7a8794a1aebbc8d5e2effc091623303d4a5764717e8b98a5b2bfccd9e6f3000d1a2734414e5b6875828f9ca9b6c3d0ddeaf704111e2b3845525f6c798693a0adbac7d4e1eefb0800000000000000000000000000000000000000000000000000000000" },
    { "id": "past-the-prefix", "comment": "six codewords issued, two of them parity", "inputs": { "message": "010e1b2835424f5c697683909daab7c4d1deebf805121f2c394653606d7a8794a1aebbc8d5e2effc091623303d4a5764717e8b98a5b2bfccd9e6f3000d1a2734414e5b6875828f9ca9b6c3d0ddeaf704111e2b3845525f6c798693a0adbac7d4e1eefb08", "issued": "00000006" }, "output": "00060000000004010e1b2835424f5c697683909daab7c4d1deebf805121f2c394653606d7a8794a1aebbc8d5e2effc091623303d4a5764717e8b98a5b2bfccd9e6f3000d1a2734414e5b6875828f9ca9b6c3d0ddeaf704111e2b3845525f6c798693a0adbac7d4e1eefb0800000000000000000000000000000000000000000000000000000000" },
    { "id": "zero-length-value", "comment": "an encoder for zero bytes holds no chunks", "inputs": { "message": "", "issued": "00000000" }, "output": "00000000000000" },
    { "id": "last-index-next", "comment": "65535 issued, so next is the last index and the encoder is not yet exhausted", "inputs": { "message": "090c0f1215181b1e2124272a2d303336393c3f4245484b4e5154575a5d606366", "issued": "0000ffff" }, "output": "ffff0000000001090c0f1215181b1e2124272a2d303336393c3f4245484b4e5154575a5d606366" },
    { "id": "exhausted", "comment": "every index issued: next stays at 65535 and exhausted is set", "inputs": { "message": "090c0f1215181b1e2124272a2d303336393c3f4245484b4e5154575a5d606366", "issued": "00010000" }, "output": "ffff0100000001090c0f1215181b1e2124272a2d303336393c3f4245484b4e5154575a5d606366" },
    { "id": "exhausted-at-the-last-index", "comment": "stored bytes the reader accepts", "inputs": { "bytes": "ffff010000000207121d28333e49545f6a75808b96a1acb7c2cdd8e3eef9040f1a25303b46515c67727d88939ea9b4000000000000000000000000000000000000000000000000" }, "output": "ffff010000000207121d28333e49545f6a75808b96a1acb7c2cdd8e3eef9040f1a25303b46515c67727d88939ea9b4000000000000000000000000000000000000000000000000" },
    { "id": "exhausted-byte-two", "comment": "exhausted is 0x00 or 0x01 and nothing else", "result": "invalid", "inputs": { "bytes": "0001020000000207121d28333e49545f6a75808b96a1acb7c2cdd8e3eef9040f1a25303b46515c67727d88939ea9b4000000000000000000000000000000000000000000000000" } },
    { "id": "exhausted-before-the-last-index", "comment": "exhausted only when next is 65535", "result": "invalid", "inputs": { "bytes": "0001010000000207121d28333e49545f6a75808b96a1acb7c2cdd8e3eef9040f1a25303b46515c67727d88939ea9b4000000000000000000000000000000000000000000000000" } },
    { "id": "count-beyond-the-buffer", "comment": "a count the buffer does not hold", "result": "invalid", "inputs": { "bytes": "0001000000000307121d28333e49545f6a75808b96a1acb7c2cdd8e3eef9040f1a25303b46515c67727d88939ea9b4000000000000000000000000000000000000000000000000" } },
    { "id": "count-short-of-the-buffer", "comment": "bytes left after the last chunk the count names", "result": "invalid", "inputs": { "bytes": "0001000000000107121d28333e49545f6a75808b96a1acb7c2cdd8e3eef9040f1a25303b46515c67727d88939ea9b4000000000000000000000000000000000000000000000000" } },
    { "id": "trailing-byte", "comment": "one byte after the last chunk", "result": "invalid", "inputs": { "bytes": "0001000000000207121d28333e49545f6a75808b96a1acb7c2cdd8e3eef9040f1a25303b46515c67727d88939ea9b400000000000000000000000000000000000000000000000000" } },
    { "id": "shorter-than-the-fixed-fields", "comment": "six bytes cannot hold next, exhausted and count", "result": "invalid", "inputs": { "bytes": "000100000000" } }
  ]
}
