{
  "schema_version": 1,
  "algorithm": "braid-kdf-ok",
  "source": "generated by tacenta-model Vectors.lean (lake exe genvectors braid)",
  "vectors": [
    { "id": "epoch-one", "inputs": { "ss": "1111111111111111111111111111111111111111111111111111111111111111", "epoch": "0000000000000001" }, "output": "05aac40f0de49ffda44018d74bb9ac6589d60cd7dad09667ec0d8d056b61baae" },
    { "id": "epoch-two", "inputs": { "ss": "1111111111111111111111111111111111111111111111111111111111111111", "epoch": "0000000000000002" }, "output": "983dcd5494adc1af7843c1910a656d84d786624d3417da60907df52711917193" },
    { "id": "epoch-crosses-a-byte", "inputs": { "ss": "2222222222222222222222222222222222222222222222222222222222222222", "epoch": "0000000000000100" }, "output": "ca1260458c3ac70c405ad7d5990fe5a656ea7e964c8a90a405826782eae31892" },
    { "id": "zero-secret", "inputs": { "ss": "0000000000000000000000000000000000000000000000000000000000000000", "epoch": "0000000000000001" }, "output": "fd060d7ff97dc8565efe3e3a28336c00fb3182d36cdcde661895d706f6e2df4c" }
  ]
}
