{
  "schema_version": 1,
  "algorithm": "identity-classification",
  "source": "generated by tacenta-model Vectors.lean (lake exe genvectors identity-classification), from Model.IdentityRecords.classify, session-establishment.md, Records, expectations and attribution, Classification; each row's class or refusal is the table's, embedded as a literal, and the generator writes nothing if the model disagrees; the inputs are the presented key and the record's current and retired sets, each a list of 32-byte keys; the output is the class, 01 same, 02 new, 03 retired. Layout: tacenta-test-vectors/README.md, Vector layouts",
  "vectors": [
    { "id": "empty-record", "comment": "a record whose two sets are both empty classifies every identity key as new", "inputs": { "key": "8520f0098930a754748b7ddcb43ef75a0dbf3a0d26381af4eba4a98eaa9b4e6a", "current": "", "retired": "" }, "output": "02" },
    { "id": "same", "comment": "the key is current", "inputs": { "key": "8520f0098930a754748b7ddcb43ef75a0dbf3a0d26381af4eba4a98eaa9b4e6a", "current": "8520f0098930a754748b7ddcb43ef75a0dbf3a0d26381af4eba4a98eaa9b4e6a", "retired": "" }, "output": "01" },
    { "id": "new", "comment": "another identity key", "inputs": { "key": "de9edb7d7b7dc1b4d35b61c2ece435373f8343c85b78674dadfc7e146f882b4f", "current": "8520f0098930a754748b7ddcb43ef75a0dbf3a0d26381af4eba4a98eaa9b4e6a", "retired": "" }, "output": "02" },
    { "id": "retired", "comment": "the key is retired", "inputs": { "key": "8520f0098930a754748b7ddcb43ef75a0dbf3a0d26381af4eba4a98eaa9b4e6a", "current": "", "retired": "8520f0098930a754748b7ddcb43ef75a0dbf3a0d26381af4eba4a98eaa9b4e6a" }, "output": "03" },
    { "id": "retired-over-same", "comment": "a key in both sets is retired", "inputs": { "key": "8520f0098930a754748b7ddcb43ef75a0dbf3a0d26381af4eba4a98eaa9b4e6a", "current": "8520f0098930a754748b7ddcb43ef75a0dbf3a0d26381af4eba4a98eaa9b4e6a", "retired": "8520f0098930a754748b7ddcb43ef75a0dbf3a0d26381af4eba4a98eaa9b4e6a" }, "output": "03" },
    { "id": "retired-set-holds-another-key", "comment": "only another key is retired", "inputs": { "key": "8520f0098930a754748b7ddcb43ef75a0dbf3a0d26381af4eba4a98eaa9b4e6a", "current": "", "retired": "de9edb7d7b7dc1b4d35b61c2ece435373f8343c85b78674dadfc7e146f882b4f" }, "output": "02" },
    { "id": "torsion-translate", "comment": "the presented key is the current key's point plus a torsion point of order 8", "result": "invalid", "refusal": "invalid-identity-key", "inputs": { "key": "ec06a18b2851717cbad4dda975daa176baef2f520371e51e5383029272448859", "current": "8520f0098930a754748b7ddcb43ef75a0dbf3a0d26381af4eba4a98eaa9b4e6a", "retired": "" } },
    { "id": "same-among-three", "comment": "the second of three current keys", "inputs": { "key": "ce8d3ad1ccb633ec7b70c17814a5c76ecd029685050d344745ba05870e587d59", "current": "a4e09292b651c278b9772c569f5fa9bb13d906b46ab68c9df9dc2b4409f8a209ce8d3ad1ccb633ec7b70c17814a5c76ecd029685050d344745ba05870e587d595fef13fc76023a9ee6ded987b6aa93958cdc2097ef9fc845d5319c9ca100d35e", "retired": "" }, "output": "01" },
    { "id": "presented-all-bits-set", "comment": "the presented key has bit 255 set", "result": "invalid", "refusal": "decode-failure", "inputs": { "key": "ffffffffffffffffffffffffffffffffffffffffffffffffffffffffffffffff", "current": "8520f0098930a754748b7ddcb43ef75a0dbf3a0d26381af4eba4a98eaa9b4e6a", "retired": "" } },
    { "id": "presented-u-p", "comment": "the presented key is u = p", "result": "invalid", "refusal": "decode-failure", "inputs": { "key": "edffffffffffffffffffffffffffffffffffffffffffffffffffffffffffff7f", "current": "8520f0098930a754748b7ddcb43ef75a0dbf3a0d26381af4eba4a98eaa9b4e6a", "retired": "" } },
    { "id": "malformed-current-member", "comment": "a current member is u = p, although the key matches another member", "result": "invalid", "refusal": "malformed-record", "inputs": { "key": "8520f0098930a754748b7ddcb43ef75a0dbf3a0d26381af4eba4a98eaa9b4e6a", "current": "8520f0098930a754748b7ddcb43ef75a0dbf3a0d26381af4eba4a98eaa9b4e6aedffffffffffffffffffffffffffffffffffffffffffffffffffffffffffff7f", "retired": "" } },
    { "id": "malformed-retired-member", "comment": "a retired member has bit 255 set", "result": "invalid", "refusal": "malformed-record", "inputs": { "key": "8520f0098930a754748b7ddcb43ef75a0dbf3a0d26381af4eba4a98eaa9b4e6a", "current": "8520f0098930a754748b7ddcb43ef75a0dbf3a0d26381af4eba4a98eaa9b4e6a", "retired": "ffffffffffffffffffffffffffffffffffffffffffffffffffffffffffffffff" } },
    { "id": "malformed-member-before-the-match", "comment": "the current set's only member is u = p and the key is retired: every member is checked", "result": "invalid", "refusal": "malformed-record", "inputs": { "key": "8520f0098930a754748b7ddcb43ef75a0dbf3a0d26381af4eba4a98eaa9b4e6a", "current": "edffffffffffffffffffffffffffffffffffffffffffffffffffffffffffff7f", "retired": "8520f0098930a754748b7ddcb43ef75a0dbf3a0d26381af4eba4a98eaa9b4e6a" } },
    { "id": "duplicate-members", "comment": "a list with a repeated member is the set of its members", "inputs": { "key": "8520f0098930a754748b7ddcb43ef75a0dbf3a0d26381af4eba4a98eaa9b4e6a", "current": "8520f0098930a754748b7ddcb43ef75a0dbf3a0d26381af4eba4a98eaa9b4e6a8520f0098930a754748b7ddcb43ef75a0dbf3a0d26381af4eba4a98eaa9b4e6ade9edb7d7b7dc1b4d35b61c2ece435373f8343c85b78674dadfc7e146f882b4f", "retired": "" }, "output": "01" },
    { "id": "duplicate-members-removed", "comment": "the same set without the repetition", "inputs": { "key": "8520f0098930a754748b7ddcb43ef75a0dbf3a0d26381af4eba4a98eaa9b4e6a", "current": "8520f0098930a754748b7ddcb43ef75a0dbf3a0d26381af4eba4a98eaa9b4e6ade9edb7d7b7dc1b4d35b61c2ece435373f8343c85b78674dadfc7e146f882b4f", "retired": "" }, "output": "01" },
    { "id": "non-identity-member-is-not-malformed", "comment": "a canonical member that is not an identity key, u = 0, does not make the record malformed", "inputs": { "key": "8520f0098930a754748b7ddcb43ef75a0dbf3a0d26381af4eba4a98eaa9b4e6a", "current": "8520f0098930a754748b7ddcb43ef75a0dbf3a0d26381af4eba4a98eaa9b4e6a", "retired": "0000000000000000000000000000000000000000000000000000000000000000" }, "output": "01" },
    { "id": "presented-non-identity-key-in-the-record", "comment": "the presented key u = 0 is refused, although its bytes are a member", "result": "invalid", "refusal": "invalid-identity-key", "inputs": { "key": "0000000000000000000000000000000000000000000000000000000000000000", "current": "", "retired": "0000000000000000000000000000000000000000000000000000000000000000" } },
    { "id": "presented-key-before-the-members", "comment": "the presented key is checked before the members: the record is also malformed", "result": "invalid", "refusal": "invalid-identity-key", "inputs": { "key": "ec06a18b2851717cbad4dda975daa176baef2f520371e51e5383029272448859", "current": "edffffffffffffffffffffffffffffffffffffffffffffffffffffffffffff7f", "retired": "" } },
    { "id": "canonical-check-first", "comment": "the presented key is u = p and a member has bit 255 set: the presented key's canonical check comes first", "result": "invalid", "refusal": "decode-failure", "inputs": { "key": "edffffffffffffffffffffffffffffffffffffffffffffffffffffffffffff7f", "current": "0900000000000000000000000000000000000000000000000000000000000080", "retired": "" } },
    { "id": "non-identity-members-never-match", "comment": "members that are not identity keys, u = 2 and a torsion translate of the key, match no presented key", "inputs": { "key": "8520f0098930a754748b7ddcb43ef75a0dbf3a0d26381af4eba4a98eaa9b4e6a", "current": "0200000000000000000000000000000000000000000000000000000000000000ec06a18b2851717cbad4dda975daa176baef2f520371e51e5383029272448859", "retired": "" }, "output": "02" }
  ]
}
