{
  "schema_version": 1,
  "algorithm": "triple-combine",
  "source": "generated by tacenta-model Vectors.lean (lake exe genvectors triple)",
  "vectors": [
    { "id": "distinct-inputs", "inputs": { "mk_ec": "1111111111111111111111111111111111111111111111111111111111111111", "mk_pq": "2222222222222222222222222222222222222222222222222222222222222222" }, "output": "1d5bd3dee300ea746fecbfa5fcbe208f95ef2ecf8bb1e2f2b9fea07eb9cc21a9" },
    { "id": "swapped", "inputs": { "mk_ec": "2222222222222222222222222222222222222222222222222222222222222222", "mk_pq": "1111111111111111111111111111111111111111111111111111111111111111" }, "output": "f893d76ac4597c0683717c97d7564c2a8a602982a936b7a8da3b06943368f8ce" },
    { "id": "equal-inputs", "inputs": { "mk_ec": "3333333333333333333333333333333333333333333333333333333333333333", "mk_pq": "3333333333333333333333333333333333333333333333333333333333333333" }, "output": "79931a0db566ea469cfe9909817824b0f40b9810a2446b62de3716ab38469c5e" },
    { "id": "zero-classical", "inputs": { "mk_ec": "0000000000000000000000000000000000000000000000000000000000000000", "mk_pq": "4444444444444444444444444444444444444444444444444444444444444444" }, "output": "65418059823f0130c47f34a3388834bf5db6db5321937d461e7253c0789c1b0c" },
    { "id": "zero-post-quantum", "inputs": { "mk_ec": "4444444444444444444444444444444444444444444444444444444444444444", "mk_pq": "0000000000000000000000000000000000000000000000000000000000000000" }, "output": "66c02e698d90e8529671abb28d72427559da733fa1297e8ee7ce28d5ff925aa2" }
  ]
}
