{
  "schema_version": 1,
  "algorithm": "gf65536-mul",
  "source": "generated by tacenta-model Vectors.lean (lake exe genvectors gf)",
  "vectors": [
    { "id": "one-times-one", "inputs": { "a": "0001", "b": "0001" }, "output": "0001" },
    { "id": "zero-annihilates", "inputs": { "a": "1234", "b": "0000" }, "output": "0000" },
    { "id": "identity", "inputs": { "a": "abcd", "b": "0001" }, "output": "abcd" },
    { "id": "doubling-no-fold", "inputs": { "a": "0001", "b": "0002" }, "output": "0002" },
    { "id": "doubling-folds", "inputs": { "a": "8000", "b": "0002" }, "output": "100b" },
    { "id": "both-high-bits", "inputs": { "a": "ffff", "b": "ffff" }, "output": "0733" },
    { "id": "asymmetric", "inputs": { "a": "1234", "b": "5678" }, "output": "6324" },
    { "id": "generator-square", "inputs": { "a": "0003", "b": "0003" }, "output": "0005" }
  ]
}
