{
  "schema_version": 1,
  "algorithm": "initial-message-encoding",
  "source": "generated by tacenta-model Vectors.lean (lake exe genvectors initial)",
  "vectors": [
    { "id": "with-one-time-prekey", "inputs": { "identity": "050a0a0a0a0a0a0a0a0a0a0a0a0a0a0a0a0a0a0a0a0a0a0a0a0a0a0a0a0a0a0a0a", "ephemeral": "050b0b0b0b0b0b0b0b0b0b0b0b0b0b0b0b0b0b0b0b0b0b0b0b0b0b0b0b0b0b0b0b", "kem_ciphertext": "c0de", "signed_prekey_id": "00000003", "one_time_prekey_id": "00000004", "kem_prekey_id": "00000005", "ratchet_message": "dead" }, "output": "0102050a0a0a0a0a0a0a0a0a0a0a0a0a0a0a0a0a0a0a0a0a0a0a0a0a0a0a0a0a0a0a0a050b0b0b0b0b0b0b0b0b0b0b0b0b0b0b0b0b0b0b0b0b0b0b0b0b0b0b0b0b0b0b0b00000002c0de000000030000000400000005dead" },
    { "id": "without-one-time-prekey", "inputs": { "identity": "050a0a0a0a0a0a0a0a0a0a0a0a0a0a0a0a0a0a0a0a0a0a0a0a0a0a0a0a0a0a0a0a", "ephemeral": "050b0b0b0b0b0b0b0b0b0b0b0b0b0b0b0b0b0b0b0b0b0b0b0b0b0b0b0b0b0b0b0b", "kem_ciphertext": "c0de", "signed_prekey_id": "00000003", "one_time_prekey_id": "00000000", "kem_prekey_id": "00000005", "ratchet_message": "dead" }, "output": "0102050a0a0a0a0a0a0a0a0a0a0a0a0a0a0a0a0a0a0a0a0a0a0a0a0a0a0a0a0a0a0a0a050b0b0b0b0b0b0b0b0b0b0b0b0b0b0b0b0b0b0b0b0b0b0b0b0b0b0b0b0b0b0b0b00000002c0de000000030000000000000005dead" },
    { "id": "empty-kem-ciphertext", "inputs": { "identity": "050a0a0a0a0a0a0a0a0a0a0a0a0a0a0a0a0a0a0a0a0a0a0a0a0a0a0a0a0a0a0a0a", "ephemeral": "050b0b0b0b0b0b0b0b0b0b0b0b0b0b0b0b0b0b0b0b0b0b0b0b0b0b0b0b0b0b0b0b", "kem_ciphertext": "", "signed_prekey_id": "01020304", "one_time_prekey_id": "fffefdfc", "kem_prekey_id": "00010203", "ratchet_message": "00" }, "output": "0102050a0a0a0a0a0a0a0a0a0a0a0a0a0a0a0a0a0a0a0a0a0a0a0a0a0a0a0a0a0a0a0a050b0b0b0b0b0b0b0b0b0b0b0b0b0b0b0b0b0b0b0b0b0b0b0b0b0b0b0b0b0b0b0b0000000001020304fffefdfc0001020300" }
  ]
}
