{
  "schema_version": 1,
  "algorithm": "erasure-decoder-state",
  "source": "generated by tacenta-model Vectors.lean (lake exe genvectors erasure-decoder-state), from Model.Erasure; codewords are offered in the order listed",
  "vectors": [
    { "id": "fresh", "comment": "a decoder holding nothing", "inputs": { "size": "00000064", "codewords": "" }, "output": "0000000000000064000000000000000400000000" },
    { "id": "partial", "comment": "two of four codewords, held in arrival order", "inputs": { "size": "00000064", "codewords": "000685e293c4cde97ee05ce6e61087b99945763308a2c6c8d315519d2f07287a92640001a1aebbc8d5e2effc091623303d4a5764717e8b98a5b2bfccd9e6f3000d1a2734" }, "output": "0000000000000064000000000000000400000002000685e293c4cde97ee05ce6e61087b99945763308a2c6c8d315519d2f07287a92640001a1aebbc8d5e2effc091623303d4a5764717e8b98a5b2bfccd9e6f3000d1a2734" },
    { "id": "full", "comment": "k codewords held", "inputs": { "size": "00000060", "codewords": "0005364d245f2ca1be89a9bf8ba695a8c5ccd3dab4cfbad1ae23380f2b3d0538172a0001e3eaf1f8ff060d141b222930373e454c535a61686f767d848b9299a0a7aeb5bc0000030a11181f262d343b424950575e656c737a81888f969da4abb2b9c0c7ced5dc" }, "output": "00000000000000600000000000000003000000030005364d245f2ca1be89a9bf8ba695a8c5ccd3dab4cfbad1ae23380f2b3d0538172a0001e3eaf1f8ff060d141b222930373e454c535a61686f767d848b9299a0a7aeb5bc0000030a11181f262d343b424950575e656c737a81888f969da4abb2b9c0c7ced5dc" },
    { "id": "repeats-and-extras-not-held", "comment": "a repeat at a held index and a codeword after the kth are not stored", "inputs": { "size": "00000060", "codewords": "0002c3cad1d8dfe6edf4fb020910171e252c333a41484f565d646b727980878e959c000299908b8285bcb7aea158534a4d447f7669601b12150c073e312823daddd4cfc60007f68de49fec617e4969ffcbe6d5e8858c939a740f7a116ee3f8cfeb7d4578576a0000030a11181f262d343b424950575e656c737a81888f969da4abb2b9c0c7ced5dc000958144a0650f8f27de64bf44fea4154474251da96d488d27a74fb64c97ad168c3" }, "output": "00000000000000600000000000000003000000030002c3cad1d8dfe6edf4fb020910171e252c333a41484f565d646b727980878e959c0007f68de49fec617e4969ffcbe6d5e8858c939a740f7a116ee3f8cfeb7d4578576a0000030a11181f262d343b424950575e656c737a81888f969da4abb2b9c0c7ced5dc" },
    { "id": "zero-length-value", "comment": "a decoder for zero bytes", "inputs": { "size": "00000000", "codewords": "" }, "output": "0000000000000000000000000000000000000000" },
    { "id": "widest-the-field-allows", "comment": "size 2097152 and needed 65536 sit exactly on both bounds", "inputs": { "bytes": "0000000000200000000000000001000000000000" }, "output": "0000000000200000000000000001000000000000" },
    { "id": "needed-not-the-chunk-count", "comment": "needed is ceil(size / 32)", "result": "invalid", "inputs": { "bytes": "0000000000000064000000000000000500000002000685e293c4cde97ee05ce6e61087b99945763308a2c6c8d315519d2f07287a92640001a1aebbc8d5e2effc091623303d4a5764717e8b98a5b2bfccd9e6f3000d1a2734" } },
    { "id": "needed-above-the-field", "comment": "needed above 65536, with size agreeing", "result": "invalid", "inputs": { "bytes": "0000000000200020000000000001000100000000" } },
    { "id": "fits-only-after-narrowing", "comment": "both values bounded as 64-bit integers: their low halves alone would be a valid decoder", "result": "invalid", "inputs": { "bytes": "0000000100000060000000010000000300000000" } },
    { "id": "duplicate-index", "comment": "no two held codewords share an index", "result": "invalid", "inputs": { "bytes": "0000000000000064000000000000000400000002000685e293c4cde97ee05ce6e61087b99945763308a2c6c8d315519d2f07287a9264000685e293c4cde97ee05ce6e61087b99945763308a2c6c8d315519d2f07287a9264" } },
    { "id": "more-than-needed", "comment": "at most needed codewords are held", "result": "invalid", "inputs": { "bytes": "0000000000000020000000000000000100000002000685e293c4cde97ee05ce6e61087b99945763308a2c6c8d315519d2f07287a92640001a1aebbc8d5e2effc091623303d4a5764717e8b98a5b2bfccd9e6f3000d1a2734" } },
    { "id": "count-beyond-the-buffer", "comment": "a count the buffer does not hold", "result": "invalid", "inputs": { "bytes": "0000000000000064000000000000000400000003000685e293c4cde97ee05ce6e61087b99945763308a2c6c8d315519d2f07287a92640001a1aebbc8d5e2effc091623303d4a5764717e8b98a5b2bfccd9e6f3000d1a2734" } },
    { "id": "trailing-byte", "comment": "one byte after the last codeword", "result": "invalid", "inputs": { "bytes": "0000000000000064000000000000000400000002000685e293c4cde97ee05ce6e61087b99945763308a2c6c8d315519d2f07287a92640001a1aebbc8d5e2effc091623303d4a5764717e8b98a5b2bfccd9e6f3000d1a273400" } }
  ]
}
