{
  "schema_version": 1,
  "algorithm": "aead-encrypt",
  "source": "generated by tacenta-model Vectors.lean (lake exe genvectors aead-encrypt): the padding, the IV, the HMAC-SHA256 tag over AD || ciphertext and the receiver's steps are computed from message-format.md, Authenticated encryption, with the model's HMAC; the model does not implement AES, so every AES-256 block value is a known answer from NIST SP 800-38A (F.1.5 ECB-AES256 and F.2.5 CBC-AES256) under that standard's key, each IV chosen so the cipher's input is one of its blocks; the keys are therefore not an output of the message-key expansion, which vectors/ratchet/double-ratchet.json pins",
  "vectors": [
    { "id": "empty-plaintext", "comment": "an empty plaintext gains a whole block of padding", "inputs": { "enc_key": "603deb1015ca71be2b73aef0857d77811f352c073b6108d72d9810a30914dff4", "mac_key": "c0c1c2c3c4c5c6c7c8c9cacbcccdcecfd0d1d2d3d4d5d6d7d8d9dadbdcdddedf", "iv": "7bd1aef23e508f86f92d6e016383073a", "ad": "", "plaintext": "" }, "output": "f3eed1bdb5d2a03c064b5a7e3db181f879050b8df0273d1a46c5d79c64468b38391a4f7ba3999bd6c0f8072cc4139a90" },
    { "id": "fifteen-bytes", "comment": "fifteen bytes gain one padding byte", "inputs": { "enc_key": "603deb1015ca71be2b73aef0857d77811f352c073b6108d72d9810a30914dff4", "mac_key": "c0c1c2c3c4c5c6c7c8c9cacbcccdcecfd0d1d2d3d4d5d6d7d8d9dadbdcdddedf", "iv": "ac3eae625854c4e5142cc3118b707e50", "ad": "6164676a6d707376797c7f8285888b8e9194979a", "plaintext": "02132435465768798a9bacbdcedff0" }, "output": "591ccb10d410ed26dc5ba74a3136287041e79d9480d3c11a8809e9980c5da9fcb16c318878851364b6ed891f9afee7d9" },
    { "id": "one-byte", "comment": "one byte gains fifteen", "inputs": { "enc_key": "603deb1015ca71be2b73aef0857d77811f352c073b6108d72d9810a30914dff4", "mac_key": "c0c1c2c3c4c5c6c7c8c9cacbcccdcecfd0d1d2d3d4d5d6d7d8d9dadbdcdddedf", "iv": "1ac71349ac53eb1eeaf4ce1615055de0", "ad": "00", "plaintext": "2a" }, "output": "b6ed21b99ca6f4f9f153e7b1beafed1de27ec6cab60febcfca49c5827b2bf2db535eb431ab7ad861b38eecde26f38a56" },
    { "id": "session-associated-data", "comment": "AD is CONCAT(ad, header): a length, the identity keys, then a composite header", "inputs": { "enc_key": "603deb1015ca71be2b73aef0857d77811f352c073b6108d72d9810a30914dff4", "mac_key": "c0c1c2c3c4c5c6c7c8c9cacbcccdcecfd0d1d2d3d4d5d6d7d8d9dadbdcdddedf", "iv": "86ee5636ab3aed60a5234973ee643f18", "ad": "00000042050a0a0a0a0a0a0a0a0a0a0a0a0a0a0a0a0a0a0a0a0a0a0a0a0a0a0a0a0a0a0a0a050b0b0b0b0b0b0b0b0b0b0b0b0b0b0b0b0b0b0b0b0b0b0b0b0b0b0b0b0b0b0b0b01015a5a5a5a5a5a5a5a5a5a5a5a5a5a5a5a5a5a5a5a5a5a5a5a5a5a5a5a5a5a5a5a00000007000000090000000000000003000000000000000b000000000000000304010005cdcdcdcdcdcdcdcdcdcdcdcdcdcdcdcdcdcdcdcdcdcdcdcdcdcdcdcdcdcdcdcd", "plaintext": "7071727374757677" }, "output": "23304b7a39f9f3ff067d8d8f9e24ecc79ffeb8b781b9e62f6c176d37cf0e03675b06b8d24418e78a4adc0db8dee4cff0" }
  ]
}
