{
  "schema_version": 1,
  "algorithm": "message-encoding",
  "source": "generated by tacenta-model Vectors.lean (lake exe genvectors serialization)",
  "vectors": [
    { "id": "typical", "inputs": { "dh": "0a0a0a0a0a0a0a0a0a0a0a0a0a0a0a0a0a0a0a0a0a0a0a0a0a0a0a0a0a0a0a0a", "pn": "00000007", "n": "00000009", "pq_epoch": "0000000000000003", "pq_n": "000000000000000b", "ag_epoch": "0000000000000003", "ag_type": "04", "chunk_present": "01", "chunk_index": "0005", "chunk_data": "cdcdcdcdcdcdcdcdcdcdcdcdcdcdcdcdcdcdcdcdcdcdcdcdcdcdcdcdcdcdcdcd", "ciphertext": "deadbeef" }, "output": "01010a0a0a0a0a0a0a0a0a0a0a0a0a0a0a0a0a0a0a0a0a0a0a0a0a0a0a0a0a0a0a0a00000007000000090000000000000003000000000000000b000000000000000304010005cdcdcdcdcdcdcdcdcdcdcdcdcdcdcdcdcdcdcdcdcdcdcdcdcdcdcdcdcdcdcdcddeadbeef" },
    { "id": "empty-ciphertext", "inputs": { "dh": "0b0b0b0b0b0b0b0b0b0b0b0b0b0b0b0b0b0b0b0b0b0b0b0b0b0b0b0b0b0b0b0b", "pn": "00000000", "n": "00000000", "pq_epoch": "0000000000000000", "pq_n": "0000000000000000", "ag_epoch": "0000000000000000", "ag_type": "01", "chunk_present": "01", "chunk_index": "0000", "chunk_data": "0000000000000000000000000000000000000000000000000000000000000000", "ciphertext": "" }, "output": "01010b0b0b0b0b0b0b0b0b0b0b0b0b0b0b0b0b0b0b0b0b0b0b0b0b0b0b0b0b0b0b0b0000000000000000000000000000000000000000000000000000000000000000010100000000000000000000000000000000000000000000000000000000000000000000" },
    { "id": "no-agreement-chunk", "inputs": { "dh": "0c0c0c0c0c0c0c0c0c0c0c0c0c0c0c0c0c0c0c0c0c0c0c0c0c0c0c0c0c0c0c0c", "pn": "01020304", "n": "fffefdfc", "pq_epoch": "0000000000000009", "pq_n": "0000000000000004", "ag_epoch": "0000000000000009", "ag_type": "00", "chunk_present": "00", "chunk_index": "0000", "chunk_data": "0000000000000000000000000000000000000000000000000000000000000000", "ciphertext": "00" }, "output": "01010c0c0c0c0c0c0c0c0c0c0c0c0c0c0c0c0c0c0c0c0c0c0c0c0c0c0c0c0c0c0c0c01020304fffefdfc00000000000000090000000000000004000000000000000900000000000000000000000000000000000000000000000000000000000000000000000000" }
  ]
}
