{
  "schema_version": 1,
  "algorithm": "erasure-encode",
  "source": "generated by tacenta-model Vectors.lean (lake exe genvectors erasure-encode), from Model.Erasure",
  "vectors": [
    { "id": "one-chunk-padded", "comment": "a 3-byte value is one chunk padded with zero bytes; with k = 1 every parity codeword is that chunk again", "inputs": { "message": "010203", "indices": "0000000100020003" }, "output": "0102030000000000000000000000000000000000000000000000000000000000010203000000000000000000000000000000000000000000000000000000000001020300000000000000000000000000000000000000000000000000000000000102030000000000000000000000000000000000000000000000000000000000" },
    { "id": "header-and-mac", "comment": "96 bytes, the Braid's header with its MAC: three chunks, then parity", "inputs": { "message": "030a11181f262d343b424950575e656c737a81888f969da4abb2b9c0c7ced5dce3eaf1f8ff060d141b222930373e454c535a61686f767d848b9299a0a7aeb5bcc3cad1d8dfe6edf4fb020910171e252c333a41484f565d646b727980878e959c", "indices": "000000010002000300040005000600070008" }, "output": "030a11181f262d343b424950575e656c737a81888f969da4abb2b9c0c7ced5dce3eaf1f8ff060d141b222930373e454c535a61686f767d848b9299a0a7aeb5bcc3cad1d8dfe6edf4fb020910171e252c333a41484f565d646b727980878e959c232a31383fc6cdd4db626970777e050c131aa1a8afb6bd444b5259e0e7eef5fcd6adc4bfcc819ea989dfebc6f5c8e5ecf3fa542f5a314e03182f0b5d6558774a364d245f2ca1be89a9bf8ba695a8c5ccd3dab4cfbad1ae23380f2b3d0538172a166d047f0c415e69499fab86b588a5acb3ba94ef9af18ec3d8efcb1d2518370af68de49fec617e4969ffcbe6d5e8858c939a740f7a116ee3f8cfeb7d4578576ab8f4aae6b0d8d25dc62b942f8a21746762713a763468325a54db44a91ab108a3" },
    { "id": "last-chunk-padded", "comment": "100 bytes: four chunks, the last padded with 28 zero bytes, and the parity interpolates the padding", "inputs": { "message": "010e1b2835424f5c697683909daab7c4d1deebf805121f2c394653606d7a8794a1aebbc8d5e2effc091623303d4a5764717e8b98a5b2bfccd9e6f3000d1a2734414e5b6875828f9ca9b6c3d0ddeaf704111e2b3845525f6c798693a0adbac7d4e1eefb08", "indices": "0000000100020003000400050006000700080009" }, "output": "010e1b2835424f5c697683909daab7c4d1deebf805121f2c394653606d7a8794a1aebbc8d5e2effc091623303d4a5764717e8b98a5b2bfccd9e6f3000d1a2734414e5b6875828f9ca9b6c3d0ddeaf704111e2b3845525f6c798693a0adbac7d4e1eefb0800000000000000000000000000000000000000000000000000000000c5a2d7846415d7cbb2ac8dcd1fb464a56b24b2b4d9291f04984161cce650d99965027464ca6495e3462e7646a163f5dd5e1d790f05b39eda1e28692c0afa3a0a85e293c4cde97ee05ce6e61087b99945763308a2c6c8d315519d2f07287a9264254230a4f6ba13f461b27eeb44641f99f2b48841ffa0ad474ed21427090a168398e6e2c003e203248518b3fa8663ec5153ab6c630b3069d0fca1e260d4a9e48338464c20bc93a54981a3f236ba7c850a6397be12eca683e5d3a00f16a082d53f" },
    { "id": "ct2-and-mac-far-indices", "comment": "192 bytes, the second ciphertext half with its MAC: six chunks, parity just after them and at indices whose high byte is set", "inputs": { "message": "05223f5c7996b3d0ed0a2744617e9bb8d5f20f2c496683a0bddaf714314e6b88a5c2dffc193653708daac7e4011e3b587592afcce90623405d7a97b4d1ee0b2845627f9cb9d6f3102d4a6784a1bedbf815324f6c89a6c3e0fd1a3754718eabc8e5021f3c597693b0cdea0724415e7b98b5d2ef0c294663809dbad7f4112e4b6885a2bfdcf91633506d8aa7c4e1fe1b3855728facc9e603203d5a7794b1ceeb0825425f7c99b6d3f00d2a4764819ebbd8f5122f4c6986a3c0ddfa1734516e8ba8", "indices": "0000000100020003000400050006000700080009000a000b00ff01001000" }, "output": "05223f5c7996b3d0ed0a2744617e9bb8d5f20f2c496683a0bddaf714314e6b88a5c2dffc193653708daac7e4011e3b587592afcce90623405d7a97b4d1ee0b2845627f9cb9d6f3102d4a6784a1bedbf815324f6c89a6c3e0fd1a3754718eabc8e5021f3c597693b0cdea0724415e7b98b5d2ef0c294663809dbad7f4112e4b6885a2bfdcf91633506d8aa7c4e1fe1b3855728facc9e603203d5a7794b1ceeb0825425f7c99b6d3f00d2a4764819ebbd8f5122f4c6986a3c0ddfa1734516e8ba8c7e2df0a194053868ddcc7120328597897b2cdec0b2641605d8c97c2d1180b5e6782bfaaf9e033266d7ca7b2e3c8f91837526d8cabc6e1003d2c7762b1b8ebfeeece651a24dde996b0417d02b03e70543bffe4c0a76b684ce79caa5f6b0836c37a2ef45b359c78d7a100ec4395bfe4b4af9f7020330bfcac76ddbb1efa492782c28e863447730ab8d3ef9e2cbf105c14973fc8800bab440c04b2c9f18826556d56ee9775d6321bf942ae8f6d1a11c87403df5ce09f4bd06c15f358b09967c42c7a2cdb8bebbd57077f21c3935e07e4b677c87022eb5cfcae590d653fd599f9a387d5b946486935cadcf5a15e023b194f18288ddb84bc01573bc0c6ebb7545a776873382514b7b4a9802b203dc3baf6e97ae7627de673eef1baa39a35363706a9" },
    { "id": "ek-vector", "comment": "1536 bytes, the encapsulation-key vector: 48 chunks, the last two systematic codewords and two parity codewords", "inputs": { "message": "11304f6e8daccbea0928476685a4c3e201203f5e7d9cbbdaf91837567594b3d2f1102f4e6d8cabcae90827466584a3c2e1001f3e5d7c9bbad9f81736557493b2d1f00f2e4d6c8baac9e80726456483a2c1e0ff1e3d5c7b9ab9d8f71635547392b1d0ef0e2d4c6b8aa9c8e70625446382a1c0dffe1d3c5b7a99b8d7f61534537291b0cfee0d2c4b6a89a8c7e60524436281a0bfdefd1c3b5a7998b7d6f51433527190afceed0c2b4a6988a7c6e504234261809fbeddfc1b3a597897b6d5f4133251708faecdec0b2a496887a6c5e4032241607f9ebddcfb1a39587796b5d4f31231506f8eadcceb0a29486786a5c4e30221405f7e9dbcdbfa1938577695b4d3f211304f6e8daccbea0928476685a4c3e201203f5e7d9cbbdaf91837567594b3d2f1102f4e6d8cabcae90827466584a3c2e1001f3e5d7c9bbad9f81736557493b2d1f00f2e4d6c8baac9e80726456483a2c1e0ff1e3d5c7b9ab9d8f71635547392b1d0ef0e2d4c6b8aa9c8e70625446382a1c0dffe1d3c5b7a99b8d7f61534537291b0cfee0d2c4b6a89a8c7e60524436281a0bfdefd1c3b5a7998b7d6f51433527190afceed0c2b4a6988a7c6e504234261809fbeddfc1b3a597897b6d5f4133251708faecdec0b2a496887a6c5e4032241607f9ebddcfb1a39587796b5d4f31231506f8eadcceb0a29486786a5c4e30221405f7e9dbcdbfa1938577695b4d3f211304f6e8daccbea0928476685a4c3e201203f5e7d9cbbdaf91837567594b3d2f1102f4e6d8cabcae90827466584a3c2e1001f3e5d7c9bbad9f81736557493b2d1f00f2e4d6c8baac9e80726456483a2c1e0ff1e3d5c7b9ab9d8f71635547392b1d0ef0e2d4c6b8aa9c8e70625446382a1c0dffe1d3c5b7a99b8d7f61534537291b0cfee0d2c4b6a89a8c7e60524436281a0bfdefd1c3b5a7998b7d6f51433527190afceed0c2b4a6988a7c6e504234261809fbeddfc1b3a597897b6d5f4133251708faecdec0b2a496887a6c5e4032241607f9ebddcfb1a39587796b5d4f31231506f8eadcceb0a29486786a5c4e30221405f7e9dbcdbfa1938577695b4d3f211304f6e8daccbea0928476685a4c3e201203f5e7d9cbbdaf91837567594b3d2f1102f4e6d8cabcae90827466584a3c2e1001f3e5d7c9bbad9f81736557493b2d1f00f2e4d6c8baac9e80726456483a2c1e0ff1e3d5c7b9ab9d8f71635547392b1d0ef0e2d4c6b8aa9c8e70625446382a1c0dffe1d3c5b7a99b8d7f61534537291b0cfee0d2c4b6a89a8c7e60524436281a0bfdefd1c3b5a7998b7d6f51433527190afceed0c2b4a6988a7c6e504234261809fbeddfc1b3a597897b6d5f4133251708faecdec0b2a496887a6c5e4032241607f9ebddcfb1a39587796b5d4f31231506f8eadcceb0a29486786a5c4e30221405f7e9dbcdbfa1938577695b4d3f211304f6e8daccbea0928476685a4c3e201203f5e7d9cbbdaf91837567594b3d2f1102f4e6d8cabcae90827466584a3c2e1001f3e5d7c9bbad9f81736557493b2d1f00f2e4d6c8baac9e80726456483a2c1e0ff1e3d5c7b9ab9d8f71635547392b1d0ef0e2d4c6b8aa9c8e70625446382a1c0dffe1d3c5b7a99b8d7f61534537291b0cfee0d2c4b6a89a8c7e60524436281a0bfdefd1c3b5a7998b7d6f51433527190afceed0c2b4a6988a7c6e504234261809fbeddfc1b3a597897b6d5f4133251708faecdec0b2a496887a6c5e4032241607f9ebddcfb1a39587796b5d4f31231506f8eadcceb0a29486786a5c4e30221405f7e9dbcdbfa1938577695b4d3f211304f6e8daccbea0928476685a4c3e201203f5e7d9cbbdaf91837567594b3d2f1102f4e6d8cabcae90827466584a3c2e1001f3e5d7c9bbad9f81736557493b2d1f00f2e4d6c8baac9e80726456483a2c1e0ff1e3d5c7b9ab9d8f71635547392b1d0ef0e2d4c6b8aa9c8e70625446382a1c0dffe1d3c5b7a99b8d7f61534537291b0cfee0d2c4b6a89a8c7e60524436281a0bfdefd1c3b5a7998b7d6f51433527190afceed0c2b4a6988a7c6e504234261809fbeddfc1b3a597897b6d5f4133251708faecdec0b2a496887a6c5e4032241607f9ebddcfb1a39587796b5d4f31231506f8eadcceb0a29486786a5c4e30221405f7e9dbcdbfa1938577695b4d3f2", "indices": "002e002f003003e8" }, "output": "51708faecdec0b2a496887a6c5e4032241607f9ebddcfb1a39587796b5d4f31231506f8eadcceb0a29486786a5c4e30221405f7e9dbcdbfa1938577695b4d3f27eb520ebe229a46f66ad28e3ea21ac676ea570833241f407b6c5788b3a49fc0f185701b184cb8535004f09b98cc38d3d08474b6b713fcfeff5bb43637937c7e7" },
    { "id": "stream-exhaustion", "comment": "the stream issues indices 0 to 65535, one codeword each, and nothing after; stream_length is how many it issues in all", "inputs": { "message": "090c0f1215181b1e2124272a2d303336393c3f4245484b4e5154575a5d606366", "indices": "00000001fffeffff", "stream_length": "00010000" }, "output": "090c0f1215181b1e2124272a2d303336393c3f4245484b4e5154575a5d606366090c0f1215181b1e2124272a2d303336393c3f4245484b4e5154575a5d606366090c0f1215181b1e2124272a2d303336393c3f4245484b4e5154575a5d606366090c0f1215181b1e2124272a2d303336393c3f4245484b4e5154575a5d606366" },
    { "id": "zero-length-value", "comment": "a value of zero bytes is zero chunks, so the polynomials have no points and every codeword is 32 zero bytes; the stream still issues indices 0 to 65535, one codeword each, and nothing after", "inputs": { "message": "", "indices": "000000010002ffff", "stream_length": "00010000" }, "output": "0000000000000000000000000000000000000000000000000000000000000000000000000000000000000000000000000000000000000000000000000000000000000000000000000000000000000000000000000000000000000000000000000000000000000000000000000000000000000000000000000000000000000000" }
  ]
}
