{
  "schema_version": 1,
  "algorithm": "triple-split",
  "source": "generated by tacenta-model Vectors.lean (lake exe genvectors split)",
  "vectors": [
    { "id": "ones", "inputs": { "sk": "0101010101010101010101010101010101010101010101010101010101010101" }, "output": "ac7f12eb0fe42127ba3e2d1e75a404790d5a97461bacade218d04bc1e8ff8ef643ee07ea13d90bcabc15d96b1e71e69da18ba6938b9d433991359c64f9dc3cd4" },
    { "id": "zeros", "inputs": { "sk": "0000000000000000000000000000000000000000000000000000000000000000" }, "output": "62ac2548744ebd8aba48026e8d32b22abf3cf3ccde916977391972ff5ef4e9cbf24d8e0205f5a08ef0e74cc1a62c02c3a000febb574a3758b8d4cc33760eea88" },
    { "id": "mixed", "inputs": { "sk": "a5a5a5a5a5a5a5a5a5a5a5a5a5a5a5a5a5a5a5a5a5a5a5a5a5a5a5a5a5a5a5a5" }, "output": "a2de1cc2fe8dedd43feefc44c829b69015cab12857485a54f99f00a00e6b6899ab1855a63aa949ad7aefe507291b2f69b68511a6d666e21c7bb46ab56003a0b1" }
  ]
}
